id,title,description,thumbnail,thumbEmoji,tags,difficulty,date,featured,likes,views,comments,instagram,youtube,github,components,notes
live-train-dash,"Live Train Status Dashboard","Real-time Solari-style departure board for the Naihati–Sealdah route. Scrapes RailYatri via CORS proxy and renders a flip-display animation in React.",thumbnails/train.jpg,🚂,Raspberry Pi|React|Web|Scraping,intermediate,2025-11-20,true,0,0,0,,,,"Raspberry Pi|React|RailYatri API|CORS Proxy",
follower-garden,"Follower Garden","Every Instagram follower becomes a flower in a Ghibli-aesthetic garden. Real-time follow/unfollow animations powered by a FastAPI + instaloader backend on a Raspberry Pi.",thumbnails/garden.jpg,🌸,Raspberry Pi|FastAPI|React|Instagram,advanced,2025-12-01,false,0,0,0,,,,"Raspberry Pi 5|FastAPI|instaloader|SQLite|e-ink display",
aether-rf-art,"AETHER — RF Visualizer","Ambient art object that reads Wi-Fi & Bluetooth RF signal strength via an AD8318 detector and breathes light through a WS2812B LED ring. FreeRTOS dual-core firmware.",thumbnails/aether.jpg,📡,ESP32|Hardware|LEDs|FreeRTOS,advanced,2025-10-10,false,0,0,0,,,,"ESP32|AD8318 RF Detector|WS2812B|FreeRTOS|Home Assistant",
sensor-node,"Modular Home Sensor Node","Battery-powered ESP32-C3 sensor node (XIAO form factor) with TCA9548A I2C multiplexer for simultaneous multi-sensor readings. 6-month battery target via aggressive deep sleep.",thumbnails/sensor.jpg,🔋,ESP32|Home Automation|Hardware|MQTT,intermediate,2025-09-15,false,0,0,0,,,,"XIAO ESP32-C3|TCA9548A|MQTT|Home Assistant|ESP-NOW",
desk-pet,"3D-Printed Desk Pet","Round ESP32-S3 display renders animated bird faces with typographic clock eyes. OTA firmware updates via GitHub Actions. Fully 3D printable enclosure.",thumbnails/deskpet.jpg,🐦,ESP32|3D Print|Animations|OTA,beginner,2025-08-22,false,0,0,0,,,,"ESP32-S3 Round Display|GitHub Actions|3D Printing|LVGL",
